{
  "vuls_version": "0.2.0",
  "record_type": "subject",
  "subject_id": "synthetic-dog-estimated",
  "species": "Canis lupus familiaris",
  "sex": "male",
  "age_information": {
    "status": "estimated",
    "birth_date": null,
    "birth_date_precision": "unknown",
    "age_estimate": {
      "value": 8,
      "unit": "year",
      "estimated_at": "2026-10-31",
      "estimation_method": "owner_reported"
    }
  }
}
